{
  "strategy": "semantic",
  "semantic_config": {
    "embedding_model": "nomic-embed-text",
    "similarity_threshold": 0.15,
    "use_keywords": true,
    "domain_signatures": {
      "code": [
        "write a function",
        "write a python",
        "write a javascript",
        "write a sql",
        "implement",
        "debug this",
        "fix the error",
        "fix this code",
        "time complexity of",
        "space complexity of",
        "complexity of binary",
        "complexity of sorting",
        "data structure",
        "stack and queue",
        "algorithm",
        "programming"
      ],
      "reasoning": [
        "solve this",
        "calculate the",
        "what is the probability",
        "approximate probability",
        "in a room of",
        "how many",
        "how long does it take",
        "if all",
        "all roses are",
        "all flowers",
        "what can we conclude",
        "sum of all integers",
        "train leaves",
        "traveling at",
        "mph",
        "machines make",
        "widgets",
        "word problem",
        "logic puzzle"
      ],
      "knowledge": [
        "who invented",
        "who wrote the",
        "what is the capital",
        "when did",
        "what year did",
        "what is the largest",
        "what is the speed of",
        "historical fact",
        "chemical symbol"
      ],
      "creative": [
        "write a story",
        "write a haiku",
        "write a poem",
        "write a limerick",
        "compose a poem",
        "imagine a world",
        "creative writing",
        "describe a sunset",
        "opening paragraph of a",
        "short story about",
        "poetic language"
      ],
      "legal": [
        "is this admissible",
        "hearsay exception",
        "what does the statute say",
        "legal precedent for",
        "court ruling on",
        "evidence code",
        "civil procedure",
        "criminal procedure"
      ]
    }
  },
  "fallback_behavior": "use_fallback_specialist",
  "routing_timeout_ms": 3000
}
